{
  "version": "1.0.0",
  "team": {
    "name": "Service operations",
    "role": "Maintain and improve the service",
    "members": [{"name": "Alex", "email": "alex@example.com", "role": "Service owner", "responsibilities": ["Coordinate service improvements"]}]
  },
  "objectives": ["Reduce avoidable service interruptions; agree the measurement and target with the team"],
  "calendars": [{"id": "primary", "title": "Service operations weekly", "timezone": "Europe/London"}],
  "history": {"paths": ["history/"], "lookbackMeetings": 4},
  "practice": {"confirmed": false, "groups": [{"name": "Select the agreed service practice", "paths": ["../../practices/service/service.json"], "mergedPath": "context/merged-practice.json"}]},
  "narratives": {"summary": "ABT", "retrospective": "STAR", "news": "ABT", "contributions": ["STAR", "PAR"], "confirmed": false},
  "review": {"cadence": "weekly", "recipes": []},
  "signals": [{"id": "service-updates", "recipe": "local", "fixturePath": "signals/updates.md"}]
}
